ID,Label,URL,"Search Volume",Followers,Taxonomy,"Related Interests"
912642816659,"patio container gardening",https://www.pinterest.com/ideas/patio-container-gardening/912642816659,2207,0,"lawn and garden (https://app.pinclicks.com/keyword/lawn-and-garden/909983286710)
garden types (https://app.pinclicks.com/keyword/garden-types/926108676086)
vegetable gardening (https://app.pinclicks.com/keyword/vegetable-gardening/912792279713)","container garden design layout (https://app.pinclicks.com/keyword/container-garden-design-layout/918851757365)
plants in pots outdoor backyard ideas (https://app.pinclicks.com/keyword/plants-in-pots-outdoor-backyard-ideas/954156756836)
landscaping with pots (https://app.pinclicks.com/keyword/landscaping-with-pots/913675690148)
container vegetable garden ideas (https://app.pinclicks.com/keyword/container-vegetable-garden-ideas/929942332339)
container flower garden ideas (https://app.pinclicks.com/keyword/container-flower-garden-ideas/905616565262)
large container planting ideas (https://app.pinclicks.com/keyword/large-container-planting-ideas/959779867410)
diy container gardening (https://app.pinclicks.com/keyword/diy-container-gardening/936911709230)
patio plants in pots (https://app.pinclicks.com/keyword/patio-plants-in-pots/952454571508)
flower containers ideas planters (https://app.pinclicks.com/keyword/flower-containers-ideas-planters/911479664148)
outdoor patio ideas (https://app.pinclicks.com/keyword/outdoor-patio-ideas/906451681615)"
941725050420,"patio gardening",https://www.pinterest.com/ideas/patio-gardening/941725050420,1421,0,"lawn and garden (https://app.pinclicks.com/keyword/lawn-and-garden/909983286710)
lawn and garden ideas (https://app.pinclicks.com/keyword/lawn-and-garden-ideas/909909540942)
outdoor gardening (https://app.pinclicks.com/keyword/outdoor-gardening/941397344638)","porch garden (https://app.pinclicks.com/keyword/porch-garden/921343168977)
small backyard gardens (https://app.pinclicks.com/keyword/small-backyard-gardens/931267815120)
outside garden ideas (https://app.pinclicks.com/keyword/outside-garden-ideas/905326228330)
patio garden ideas (https://app.pinclicks.com/keyword/patio-garden-ideas/901685364862)
home garden ideas (https://app.pinclicks.com/keyword/home-garden-ideas/900582596180)
garden crafts (https://app.pinclicks.com/keyword/garden-crafts/906657848864)
tiny balcony garden (https://app.pinclicks.com/keyword/tiny-balcony-garden/918473955793)
urban gardening balcony (https://app.pinclicks.com/keyword/urban-gardening-balcony/924613347883)
garden inspo (https://app.pinclicks.com/keyword/garden-inspo/955831807208)
outdoor garden ideas (https://app.pinclicks.com/keyword/outdoor-garden-ideas/939297382425)"
924016359114,"patio gardening ideas",https://www.pinterest.com/ideas/patio-gardening-ideas/924016359114,340,0,,
922927977728,"small patio gardening",https://www.pinterest.com/ideas/small-patio-gardening/922927977728,50,0,,
942174104600,"patio container gardening ideas full sun",https://www.pinterest.com/ideas/patio-container-gardening-ideas-full-sun/942174104600,26,0,"lawn and garden (https://app.pinclicks.com/keyword/lawn-and-garden/909983286710)
lawn and garden ideas (https://app.pinclicks.com/keyword/lawn-and-garden-ideas/909909540942)
patio ideas (https://app.pinclicks.com/keyword/patio-ideas/942175527692)","container flower garden ideas (https://app.pinclicks.com/keyword/container-flower-garden-ideas/905616565262)
full sun annuals for pots (https://app.pinclicks.com/keyword/full-sun-annuals-for-pots/936802281158)
patio container gardening (https://app.pinclicks.com/keyword/patio-container-gardening/912642816659)
full sun container ideas (https://app.pinclicks.com/keyword/full-sun-container-ideas/942595049318)
large container planting ideas (https://app.pinclicks.com/keyword/large-container-planting-ideas/959779867410)
pots in flower beds landscaping (https://app.pinclicks.com/keyword/pots-in-flower-beds-landscaping/957413899650)
flower pots outdoor full sun (https://app.pinclicks.com/keyword/flower-pots-outdoor-full-sun/935669841096)
spiller plants for containers (https://app.pinclicks.com/keyword/spiller-plants-for-containers/919673175352)
backyard garden ideas (https://app.pinclicks.com/keyword/backyard-garden-ideas/940062456802)
plants in pots outdoor backyard ideas (https://app.pinclicks.com/keyword/plants-in-pots-outdoor-backyard-ideas/954156756836)"
951976871136,"gardening apartment patio",https://www.pinterest.com/ideas/gardening-apartment-patio/951976871136,42,0,,
934874305591,"patio container gardening tips",https://www.pinterest.com/ideas/patio-container-gardening-tips/934874305591,0,0,,
